<?xml version="1.0" encoding="UTF-8"?>
<!DOCTYPE root SYSTEM "flower.dtd">
<root>

	<serviceDefinition name="WorkFlowSrv" class="com.ness.fw.shared.flower.workflow.WorkFlowFlowerService">
		<serviceMethod name="singleSignOnLogon" executionMethod="singleSignOnLogon" context="WFSingleSignOnLogonContext"/>
		<serviceMethod name="logon" executionMethod="logon" context="WFLogonContext"/>
		<serviceMethod name="logoff" executionMethod="logoff" context="WFEmptyContext"/>
		<serviceMethod name="exit" executionMethod="exit" context="WFEmptyContext"/>
		<serviceMethod name="retrieveTasks" executionMethod="retrieveTasks" context="WFRetrieveTasksContext"/>
		<serviceMethod name="getWorkItem" executionMethod="getWorkItem" context="WFGetWorkItemContext"/>
		<serviceMethod name="checkOut" executionMethod="checkOut" context="WFCheckOutContext"/>
		<serviceMethod name="checkIn" executionMethod="checkIn" context="WFCheckInContext"/>
		<serviceMethod name="cancelCheckOut" executionMethod="cancelCheckOut" context="WFCancelCheckOutContext"/>
		<serviceMethod name="postponeWorkItem" executionMethod="postponeWorkItem" context="WFPostponeWorkItemContext"/>
		<serviceMethod name="setPriorityOfProcessInstance" executionMethod="setPriorityOfProcessInstance" context="WFSetPriorityOfProcessInstanceContext"/>
		<serviceMethod name="setPriorityOfWorkItem" executionMethod="setPriorityOfWorkItem" context="WFSetPriorityOfWorkItemContext"/>
		<serviceMethod name="getProcessInstance" executionMethod="getProcessInstance" context="WFGetProcessInstanceContext"/>
		<serviceMethod name="getProcessInstanceByName" executionMethod="getProcessInstanceByName" context="WFGetProcessInstanceByNameContext"/>
		<serviceMethod name="returnWorkItemToGeneralQueue" executionMethod="returnWorkItemToGeneralQueue" context="WFReturnWorkItemToGeneralQueueContext"/>
		<serviceMethod name="retrieveProcesses" executionMethod="retrieveProcesses" context="WFRetrieveProcessesContext"/>
		<serviceMethod name="retrieveUsersForSelectSubstitute" executionMethod="retrieveUsersForSelectSubstitute" context="WFRetrieveUsersForSelectSubstituteContext"/>
		<serviceMethod name="routeWorkItem" executionMethod="routeWorkItem" context="WFRouteWorkItemContext"/>
		<serviceMethod name="retrieveUsersForWorkItemRouting" executionMethod="retrieveUsersForWorkItemRouting" context="WFRetrieveUsersForWorkItemRoutingContext"/>
		<serviceMethod name="setUserSubstitute" executionMethod="setUserSubstitute" context="WFSetUserSubstituteContext"/>
		<serviceMethod name="setCurrentUserSubstitute" executionMethod="setCurrentUserSubstitute" context="WFSetCurrentUserSubstituteContext"/>
		<serviceMethod name="getUserSubstitute" executionMethod="getUserSubstitute" context="WFGetUserSubstituteContext"/>
		<serviceMethod name="getCurrentUserSubstitute" executionMethod="getCurrentUserSubstitute" context="WFGetCurrentUserSubstituteContext"/>
		<serviceMethod name="terminateProcess" executionMethod="terminateProcess" context="WFTerminateProcessContext"/>
		<serviceMethod name="doesProcessInstanceHaveCheckedOutItems" executionMethod="doesProcessInstanceHaveCheckedOutItems" context="WFDoesProcessInstanceHaveCheckedOutItemsContext"/>
		<serviceMethod name="setUserAsAbsent" executionMethod="setUserAsAbsent" context="WFSetUserAsAbsentContext"/>
		<serviceMethod name="isAbsent" executionMethod="isAbsent" context="WFIsAbsentContext"/>
		<serviceMethod name="retrieveFilterNames" executionMethod="retrieveFilterNames" context="WFRetrieveFilterNamesContext"/>
		<serviceMethod name="getProcessTemplateNames" executionMethod="getProcessTemplateNames" context="WFGetProcessTemplateNamesContext"/>
		<serviceMethod name="retrieveUsersInOrganizationalTeam" executionMethod="retrieveUsersInOrganizationalTeam" context="WFRetrieveUsersInOrganizationalTeamContext"/>
		<serviceMethod name="getCustomerOpenProcesses" executionMethod="getCustomerOpenProcesses" context="WFGetCustomerOpenProcessesContext"/>
		<serviceMethod name="doesCustomerHaveOpenProcesses" executionMethod="doesCustomerHaveOpenProcesses" context="WFDoesCustomerHaveOpenProcessesContext"/>
		<serviceMethod name="getListOfCustomerOpenProcesses" executionMethod="getListOfCustomerOpenProcesses" context="WFGetListOfCustomerOpenProcessesContext"/>
		<serviceMethod name="autoOpeningOfNextWorkItem" executionMethod="autoOpeningOfNextWorkItem" context="WFAutoOpeningOfNextWorkItemContext"/>
		<serviceMethod name="alertForAutoOpeningOfNextWorkItem" executionMethod="alertForAutoOpeningOfNextWorkItem" context="WFAlertForAutoOpeningOfNextWorkItemContext"/>
		<serviceMethod name="prepareListOfUsers" executionMethod="prepareListOfUsers" context="WFPrepareListOfUsersContext"/>
		<serviceMethod name="forceRestart" executionMethod="forceRestart" context="WFForceRestartContext"/>
		<serviceMethod name="getLastPerformedActivity" executionMethod="getLastPerformedActivity" context="WFGetLastPerformedActivityContext"/>
		<serviceMethod name="retrievePeopleThisUserIsAuthorizedFor" executionMethod="retrievePeopleThisUserIsAuthorizedFor" context="WFRetrievePeopleThisUserIsAuthorizedForContext"/>
		<serviceMethod name="createAndStartProcessInstance" executionMethod="createAndStartProcessInstance" context="WFCreateAndStartProcessInstanceContext"/>
		<serviceMethod name="getLastHandlerOfCustomer" executionMethod="getLastHandlerOfCustomer" context="WFGetLastHandlerOfCustomerContext"/>
	</serviceDefinition>


</root>